"1792 VIP Bourbon Tour for 4","1792-vip-bourbon-tour","Includes dinner for four (4) and two (2) rooms at the Bourbon Manner Bed & Breakfast","$700"
"Ultimate Massage Package at Elements","massage-package","Includes one (1) year of massage with one (1) hour session per month, beginning January 2016","$900"
"University of Kentucky Basketball and Football Tickets",,"Includes two (2) basketball tickets and four (4) football tickets","$700"
"West Baden Springs Hotel Package with Porsche for the Weekend",,"Includes overnight stay, spa, dinner for two (2) and Porsche for the weekend","$1,700"
"UPS Flight Simulator Experience",,"","Priceless"
"Belle of Louisville Thunder Cruise for 4","belle-of-louisville-thunder-cruise","","$600"
"21c Hotel Package",,"Accommodations and dinner for two (2) at Proof on Main","$621"
"Cellar Door Chocolate-making Class for 6","cellar-door-chocolate-making-class","Includes appetizers","$800"